{
  "schemaVersion": 2,
  "kbVersion": "3.17.0",
  "updatedAt": "2026-08-28T23:50:00Z",
  "topics": [
    {
      "id": "wealth-inequality-mobility",
      "parentId": null,
      "path": "/wealth-inequality-mobility",
      "depth": 0,
      "title": "Wealth Inequality & Mobility",
      "description": "Relative vs. absolute inequality, Census/BLS/Fed wealth data, intergenerational mobility, poverty metrics, and what the evidence shows about opportunity.",
      "icon": "trending_up",
      "order": 1,
      "revision": 2,
      "updatedAt": "2026-07-04T18:00:00Z"
    },
    {
      "id": "gini-misconceptions",
      "parentId": "wealth-inequality-mobility",
      "path": "/wealth-inequality-mobility/gini-misconceptions",
      "depth": 1,
      "title": "Gini Coefficient Misconceptions",
      "description": "Why dispersion metrics alone do not prove injustice.",
      "icon": "folder",
      "order": 1,
      "revision": 1,
      "updatedAt": "2026-07-04T12:00:00Z"
    },
    {
      "id": "mobility-data",
      "parentId": "wealth-inequality-mobility",
      "path": "/wealth-inequality-mobility/mobility-data",
      "depth": 1,
      "title": "Intergenerational Mobility",
      "description": "Chetty, Census, and PSID evidence on economic mobility.",
      "icon": "folder",
      "order": 2,
      "revision": 1,
      "updatedAt": "2026-07-04T12:00:00Z"
    },
    {
      "id": "consumption-inequality",
      "parentId": "wealth-inequality-mobility",
      "path": "/wealth-inequality-mobility/consumption-inequality",
      "depth": 1,
      "title": "Consumption vs. Income Inequality",
      "description": "Why consumption data paints a different picture than pre-tax income snapshots.",
      "icon": "folder",
      "order": 3,
      "revision": 1,
      "updatedAt": "2026-07-04T12:00:00Z"
    },
    {
      "id": "profit-exploitation",
      "parentId": null,
      "path": "/profit-exploitation",
      "depth": 0,
      "title": "Profit, Exploitation & \"The Rich Get Richer\"",
      "description": "Labor theory of value, surplus value, profit as coordination signal, Bastiat/Hayek/Mises \u2014 why voluntary exchange is not theft.",
      "icon": "account_balance",
      "order": 2,
      "revision": 2,
      "updatedAt": "2026-07-04T20:00:00Z"
    },
    {
      "id": "labor-theory",
      "parentId": "profit-exploitation",
      "path": "/profit-exploitation/labor-theory",
      "depth": 1,
      "title": "Labor Theory of Value",
      "description": "Why embedded labor-hours do not determine economic value.",
      "icon": "folder",
      "order": 1,
      "revision": 2,
      "updatedAt": "2026-07-04T20:00:00Z"
    },
    {
      "id": "profit-function",
      "parentId": "profit-exploitation",
      "path": "/profit-exploitation/profit-function",
      "depth": 1,
      "title": "Economic Function of Profit",
      "description": "Profit, loss, and prices as signals for coordination and innovation.",
      "icon": "folder",
      "order": 2,
      "revision": 2,
      "updatedAt": "2026-07-04T20:00:00Z"
    },
    {
      "id": "historical-socialism",
      "parentId": null,
      "path": "/historical-socialism",
      "depth": 0,
      "title": "Historical Record of Socialism",
      "description": "USSR archives, Maoist famine, Venezuela, Cuba, Cambodia, North Korea, East Germany, China state capitalism \u2014 documented socialist and hybrid outcomes.",
      "icon": "history_edu",
      "order": 3,
      "revision": 3,
      "updatedAt": "2026-07-22T22:35:27Z"
    },
    {
      "id": "ussr-record",
      "parentId": "historical-socialism",
      "path": "/historical-socialism/ussr-record",
      "depth": 1,
      "title": "Soviet Union",
      "description": "Soviet central planning, Holodomor, 1991 collapse, Gosplan failure.",
      "icon": "folder",
      "order": 1,
      "revision": 2,
      "updatedAt": "2026-07-04T20:00:00Z"
    },
    {
      "id": "china-famine",
      "parentId": "historical-socialism",
      "path": "/historical-socialism/china-famine",
      "depth": 1,
      "title": "Maoist China",
      "description": "",
      "icon": "folder",
      "order": 2,
      "revision": 1,
      "updatedAt": "2026-07-04T12:00:00Z"
    },
    {
      "id": "venezuela-cuba",
      "parentId": "historical-socialism",
      "path": "/historical-socialism/venezuela-cuba",
      "depth": 1,
      "title": "Venezuela & Cuba",
      "description": "",
      "icon": "folder",
      "order": 3,
      "revision": 1,
      "updatedAt": "2026-07-04T12:00:00Z"
    },
    {
      "id": "nordic-democratic-socialism",
      "parentId": null,
      "path": "/nordic-democratic-socialism",
      "depth": 0,
      "title": "The Nordic Model Myth & \"Democratic Socialism\"",
      "description": "Heritage/Fraser indices, market economies with high taxes \u2014 not socialist ownership.",
      "icon": "public",
      "order": 4,
      "revision": 2,
      "updatedAt": "2026-07-04T20:00:00Z"
    },
    {
      "id": "human-nature-incentives",
      "parentId": null,
      "path": "/human-nature-incentives",
      "depth": 0,
      "title": "Human Nature, Incentives & Economic Calculation",
      "description": "Mises calculation problem, Hayek knowledge problem, incentives, public choice \u2014 including why computers do not abolish scarcity.",
      "icon": "psychology",
      "order": 5,
      "revision": 3,
      "updatedAt": "2026-07-22T22:35:27Z"
    },
    {
      "id": "calculation-problem",
      "parentId": "human-nature-incentives",
      "path": "/human-nature-incentives/calculation-problem",
      "depth": 1,
      "title": "Economic Calculation Problem",
      "description": "Why rational allocation without market prices fails at scale.",
      "icon": "folder",
      "order": 1,
      "revision": 2,
      "updatedAt": "2026-07-04T20:00:00Z"
    },
    {
      "id": "knowledge-problem",
      "parentId": "human-nature-incentives",
      "path": "/human-nature-incentives/knowledge-problem",
      "depth": 1,
      "title": "Knowledge Problem",
      "description": "Dispersed knowledge and the role of prices.",
      "icon": "folder",
      "order": 2,
      "revision": 2,
      "updatedAt": "2026-07-04T20:00:00Z"
    },
    {
      "id": "government-intervention",
      "parentId": null,
      "path": "/government-intervention",
      "depth": 0,
      "title": "Government Intervention",
      "description": "Minimum wage, healthcare, rent control, UBI, industrial policy, student debt, inflation, energy, electricity, public power, supply, trade, and infrastructure - evidence on intervention outcomes.",
      "icon": "gavel",
      "order": 6,
      "revision": 5,
      "updatedAt": "2026-08-28T23:50:00Z"
    },
    {
      "id": "minimum-wage",
      "parentId": "government-intervention",
      "path": "/government-intervention/minimum-wage",
      "depth": 1,
      "title": "Minimum Wage",
      "description": "CBO employment effects, youth unemployment, Sweden flexicurity.",
      "icon": "folder",
      "order": 1,
      "revision": 2,
      "updatedAt": "2026-07-04T20:00:00Z"
    },
    {
      "id": "healthcare-systems",
      "parentId": "government-intervention",
      "path": "/government-intervention/healthcare-systems",
      "depth": 1,
      "title": "Healthcare Systems",
      "description": "CMS, Singapore, Medicare price distortions, FDA delays.",
      "icon": "folder",
      "order": 2,
      "revision": 2,
      "updatedAt": "2026-07-04T20:00:00Z"
    },
    {
      "id": "ubi-rent-control",
      "parentId": "government-intervention",
      "path": "/government-intervention/ubi-rent-control",
      "depth": 1,
      "title": "UBI & Rent Control",
      "description": "UBI trials, Stanford rent control, housing supply.",
      "icon": "folder",
      "order": 3,
      "revision": 2,
      "updatedAt": "2026-07-04T20:00:00Z"
    },
    {
      "id": "energy-utilities",
      "parentId": "government-intervention",
      "path": "/government-intervention/energy",
      "depth": 1,
      "title": "Energy & Utilities",
      "description": "Electricity prices, public power, oil windfall taxes, LNG export bans, lease freezes, data-center loads, and water utilities.",
      "icon": "folder",
      "order": 4,
      "revision": 2,
      "updatedAt": "2026-08-28T23:50:00Z"
    },
    {
      "id": "supply-trade",
      "parentId": "government-intervention",
      "path": "/government-intervention/supply",
      "depth": 1,
      "title": "Supply, Trade & Infrastructure",
      "description": "Factory-farm bans, freight-rail nationalization, foreign farmland, food-export bans, and municipal broadband.",
      "icon": "folder",
      "order": 5,
      "revision": 1,
      "updatedAt": "2026-08-28T23:50:00Z"
    },
    {
      "id": "global-poverty-capitalism",
      "parentId": null,
      "path": "/global-poverty-capitalism",
      "depth": 0,
      "title": "Global Poverty, Capitalism & Absolute Living Standards",
      "description": "World Bank absolute poverty, growth vs degrowth, and living standards under markets.",
      "icon": "language",
      "order": 7,
      "revision": 2,
      "updatedAt": "2026-07-22T22:35:27Z"
    },
    {
      "id": "founding-principles",
      "parentId": null,
      "path": "/founding-principles",
      "depth": 0,
      "title": "American Founding Principles vs. Collectivism",
      "description": "Locke, Madison, Bastiat, Declaration \u2014 natural rights vs. collectivism.",
      "icon": "flag",
      "order": 8,
      "revision": 2,
      "updatedAt": "2026-07-04T20:00:00Z"
    },
    {
      "id": "free-speech-socialist-regimes",
      "parentId": null,
      "path": "/free-speech-socialist-regimes",
      "depth": 0,
      "title": "Free Speech, Dissent & Socialist Regimes",
      "description": "Censorship, political prisoners, and the consistent suppression of dissent under socialist governments.",
      "icon": "record_voice_over",